domain,exclude
Bicyclist talks to pedestrian in order to navigate a crowded bike path,0
Freelancer talks to client in order to negotiate a contract.,0
Student talks to enrollment advisor in order to apply to college,0
Public figure talks to publicist in order to manage their public image,0
Driver talks to a tow truck operator for roadside assistance.,0
Business owner talks to potential investor in order to secure funding.,0
Customer talks to manager in order to escalate a concern,0
NGO representative talks to local resident in order to provide aid,0
Hotline worker talks to callers in order to provide support for mental health.,0
Dance instructor talks to student in order to teach them a dance routine.,0
Investor talks to financial advisor in order to discuss investment opportunities.,0
Receptionist talks to patient to collect insurance information,0
Personal shopper talks to bride in order to select a wedding dress.,0
Financial analyst talks to investment banker in order to evaluate investment opportunities,0
Cultural anthropologist talks to research subjects in order to study and understand cultural practices and traditions,0
Business analyst talks to executive in order to analyze business strategy,0
Mechanic talks to parts supplier in order to order parts for a repair,0
Teacher talks to student in order to discuss the latter’s weak points in learning,0
Parent talks to daycare provider in order to pick up their child.,0
Web developer talks to designer in order to implement web design layouts and features,0
Human resources manager talks to executive in order to develop a company policy,0
Coach talks to player in order to motivate them to perform their best during a competition,0
Research assistant talks to lead researcher in order to provide research support.,0
Firefighter talks to bystander to identify a fire hazard,0
Stylist talks to model in order to dress them for a photoshoot,0
Homeless shelter staff member talks to client in order to understand their needs.,0
Musician talks to bandmate in order to plan a setlist,0
Marriage counselor talks to couple in order to improve their relationship,0
Scientist talks to colleague in order to collaborate on research,0
Clinical research associate talks to study coordinator in order to implement a clinical trial.,0
Flight attendant talks to passenger in order to calm them during turbulence,0
Software developer talks to quality assurance tester in order to improve software performance,0
Realtor talks to client in order to show them a property,0
Customer talks to live chat representative in order to request assistance on a website.,0
Roadside assistance operator talks to driver in order to assist them with car trouble,0
UX designer talks to user in order to determine user experience preferences,0
Pest control worker talks to homeowner in order to assess and treat pest infestation.,0
Furniture salesperson talks to customer in order to sell furniture,0
Food truck operator talks to hungry customer in order to take their order,0
Parent talks to a music teacher about the child's musical development.,0
Telemarketer talks to prospective customer in order to pitch a product,0
Retail worker talks to store manager in order to report a problem.,0
Healthcare provider talks to patient in order to discuss a treatment plan.,0
Coach talks to athlete in order to give post-game feedback.,0
Customer talks to account manager in order to close account,0
Homeowner talks to window cleaner in order to clean windows.,0
Customer talks to warranty representative in order to seek assistance with a product issue,0
Student talks to advisor in order to choose classes for the upcoming semester.,0
Journalist talks to source in order to gather information for a news story,0
Marketing professional talks to colleague in order to develop a marketing strategy,0
Real estate agent talks to seller to set a price for a property,0
Air traffic controller talks to pilot in order to navigate planes safely,0
Web content writer talks to client in order to research and write content for a website,0
Boss talks to employee in order to delegate work tasks,0
Boss talks to HR to hire a new employee,0
Expert talks to journalist in order to provide insight or analysis on a topic,0
Actor talks to makeup artist in order to get ready for a performance.,0
Actor talks to director in order to receive feedback on performance.,0
Lawyer talks to witness in order to gather evidence for a legal case,0
Accountant talks to client in order to review their tax documents.,0
Employee talks to peer in order to get feedback on a project.,0
Coach talks to team captain in order to discuss team strategy.,0
Production manager talks to factory worker in order to coordinate manufacturing tasks.,0
Recruitment consultant talks to job candidate in order to help them find employment opportunities.,0
Significant other talks to partner in order to make plans for the future.,0
Renter talks to real estate agent in order to find a new place to live,0
Landscaper talks to architect in order to plan outdoor spaces for a building,0
Marketing manager talks to team member in order to discuss marketing campaign strategies.,0
Solicitor talks to potential client in order to offer legal services.,0
Receptionist talks to visiting client in order to check them in,0
Office manager talks to maintenance worker in order to fix a broken fixture,0
Personal relocator talks to client in order to plan and coordinate moving services and relocation efforts,0
Environmental scientist talks to government officials in order to discuss environmental policies and regulations.,0
Scientist talks to lab partner in order to conduct an experiment,0
Biomedical researcher talks to medical professionals in order to report and present research findings,0
Recruiter talks to job candidate in order to conduct a pre-screening,0
Hairdresser talks to apprentice in order to teach new techniques,0
Oncologist talks to patient in order to provide cancer treatment and support services,0
Tattoo artist talks to client in order to design and apply custom tattoos,0
Engineer talks to manufacturer in order to create a product design.,0
Hospital administrator talks to medical staff in order to manage patient care.,0
Driver talks to police officer in order to report a driving incident.,0
Electrician talks to architect in order to discuss wiring plans for a building,0
Cake decorator talks to customer in order to plan a cake design,0
Researcher talks to participant in order to collect data for a study.,0
Trainer talks to animal handler in order to work with animals in a zoo,0
Postman talks to colleague to coordinate deliveries,0
Food critic talks to chef and restaurant staff in order to review and critique dining experiences,0
Member talks to gym staff in order to sign up for a fitness class.,0
Boss talks to employee in order to assign tasks for the day.,0
Carpenter talks to contractor in order to receive instructions for building a structure.,0
Firefighter talks to property owner in order to assess and contain fires,0
App developer talks to user in order to troubleshoot technical issues,0
Fortune teller talks to client in order to provide a fortune prediction.,0
Museum archivist talks to researcher in order to provide historical information,0
Patient talks to mental health professional in order to seek therapy.,0
Marketing specialist talks to graphic designer in order to create an advertisement.,0
Co-worker talks to supervisor in order to ask for a day off,0
Museum curator talks to researcher in order to plan and coordinate exhibits and collections,0
Museum docent talks to guest in order to give a tour,0
Pizza delivery person talks to customer in order to confirm address,0
Restaurant manager talks to supplier in order to order ingredients,0
Team leader talks to team members in order to assign tasks,0
Volunteer talks to supervisor in order to receive instructions for their shift.,0
Friend talks to friend in order to catch up and maintain a relationship,0
Bank representative talks to client about investment opportunities.,0
Builder talks to environmental engineer in order to ensure that construction projects are environmentally responsible,0
Teacher talks to parent in order to schedule parent-teacher conference,0
Fitness blogger talks to subscribers in order to provide workout tips,0
Outdoor guide talks to group members in order to lead an adventure activity,0
Banquet manager talks to server in order to coordinate a banquet event.,0
Student talks to tutor in order to receive academic assistance,0
Product brand manager talks to advertising team in order to develop and produce marketing campaigns for new products,0
Stock trader talks to colleague in order to discuss market trends,0
New coworkers talk to each other in order to introduce themselves,0
Geologist talks to mining company representative in order to plan mining operations,0
Coach talks to team in order to give a pep talk before a game,0
Chef talks to sous chef in order to coordinate meal preparation,0
Teacher talks to principal in order to discuss a school-wide issue.,0
Volunteer talks to coordinator in order to receive instructions on task.,0
Construction worker talks to subcontractor in order to coordinate construction tasks,0
Teacher talks to administrator in order to request supplies for their classroom,0
Blogger talks to other bloggers in order to collaborate on blog content.,0
Football coach talks to football player in order to give strategy for upcoming game,0
Coach talks to nutritionist in order to create a team meal plan.,0
Ski instructor talks to students in order to teach skiing techniques,0
Military officer talks to soldier in order to give military orders,0
Environmental activist talks to business owner in order to suggest sustainable business practices.,0
Soccer player talks to teammate in order to set up a play.,0
Customer talks to store associate in order to return a product.,0
Dentist talks to dental assistant in order to assist with a procedure,0
Employee talks to client in order to discuss a project timeline.,0
Maintenance worker talks to tenant in order to fix a broken appliance,0
Office manager talks to employee in order to assign office tasks,0
Friend talks to friend in order to give a gift.,0
Career coach talks to client in order to provide career advice,0
Musician talks to sound technician in order to adjust levels,0
Hair stylist talks to client in order to style their hair,0
Wine critic talks to winemaker in order to write a review,0
Voice coach talks to singer in order to improve their singing voice,0
Employee talks to coworker in order to report a coworker's misconduct.,0
Moderator talks to panelists in order to facilitate a discussion,0
Sales manager talks to sales team in order to review performance,0
Makeup artist talks to client in order to apply makeup for special events or photo shoots,0
Human resources representative talk to employee in order to conduct performance review,0
Chef talks to prep cook in order to delegate tasks,0
Retail worker talks to manager in order to receive employee discounts on various products,0
Parent talks to teacher about afterschool programs.,0
Television viewer talks to customer service representative in order to confirm their cable subscription.,0
Immigration officer talks to immigrant in order to process immigration documents and applications,0
Carpenter talks to customer in order to design custom woodworking projects,0
Customer talks to representative in order to return a defective item.,0
ESL teacher talks to student in order to teach English.,0
Plant nursery owner talks to customer in order to sell potted plants.,0
Employee talks to a benefits representative regarding disability benefits.,0
Historian talks to researcher in order to assist with historical research and projects,0
Developer talks to project manager in order to discuss project requirements.,0
Customer talks to bank representative in order to review account balance,0
Musician talks to recording producer in order to discuss studio sessions.,0
Administrative assistant talks to coworker in order to schedule a meeting,0
Lifeguard talks to pool-goer in order to enforce safety rules,0
Hiking guide talks to hikers in order to provide trail information and safety precautions,0
Co-worker talks to manager in order to voice concerns about workplace environment.,0
Immigration lawyer talks to client in order to help them obtain a visa,0
Homeowner talks to exterminator in order to rid home of pests.,0
Driver talks to toll booth operator in order to pay tolls.,0
Diversity trainer talks to participants in order to facilitate discussions and trainings on inclusion and diversity issues,0
Tour guide talks to driver to navigate a route,0
Hair stylist talks to bride in order to plan a wedding up-do,0
Golf coach talks to golfer in order to give swing advice,0
Photographer talks to model in order to take photos,0
Sales representative talks to purchasing agent in order to negotiate a price.,0
Siblings talk to each other in order to catch up on life events.,0
Utility company representative talks to homeowner in order to read a meter or inspect utility equipment,0
Realtor talks to seller in order to discuss home staging.,0
Maintenance worker talks to building administrator in order to address issues.,0
Entrepreneur talks to mentor in order to receive business advice.,0
Political strategist talks to politician in order to plan campaign strategy,0
Coach talks to scout in order to discuss potential recruits,0
Friend talks to friend in order to reminisce about a shared experience.,0
Volunteer talks to fellow volunteer in order to organize a charity event.,0
Child talks to friend to play a game,0
Film critic talks to director in order to write a movie review,0
Employee talks to supervisor in order to report a work-related problem.,0
Sales representative talks to account manager in order to discuss client's needs,0
College admissions officer talks to applicant in order to review application materials,0
Chef talks to line cook in order to coordinate orders,0
IT support talks to customer in order to explain how to use new software.,0
Graphic designer talks to printer in order to discuss printing specifications and delivery.,0
Public speaker talks to audience in order to sell a product or service.,0
Ensemble member talks to conductor in order to discuss a music performance,0
Producer talks to cast in order to direct a play.,0
Interviewee talks to interviewer in order to answer questions about their experience.,0
Tenant talks to landlord in order to give notice of moving out,0
Dog walker talks to client in order to coordinate pet care services,0
Intern talks to supervisor in order to receive feedback on tasks.,0
Friend talks to friend in order to apologize for miscommunication.,0
Engineer talks to contractor in order to plan and oversee construction projects,0
Employee talks to supervisor in order to request assistance on professional development,0
Physical therapist talks to medical doctor in order to coordinate care for a patient,0
Engineer talks to customer in order to understand their product needs,0
Sales manager talks to sales representative in order to provide feedback on sales calls.,0
IT help desk talks to employee in order to solve a computer issue,0
Humanitarian aid worker talks to refugee in order to provide shelter and food.,0
Marathon coach talks to clients in order to develop a training plan,0
Engineer talks to project manager about project deadlines.,0
Mechanic talks to customer in order to diagnose car problems,0
Stunt double talks to actor in order to rehearse a dangerous scene,0
IT support talks to user in order to troubleshoot tech problems,0
Attendee talks to presenter in order to ask questions during a lecture.,0
Food blogger talks to chef in order to write a restaurant review,0
Customer talks to art dealer in order to purchase artwork,0
Non-profit organization worker talks to donor in order to establish funding support,0
Patient talks to physician to inquire about prescription refills,0
Event organizer talks to vendor in order to secure supplies.,0
Set designer talks to production staff in order to design and construct theater sets,0
Event host talks to attendees in order to introduce the event.,0
Employers talk to a career counselor about workplace trends.,0
IT manager talks to system administrator in order to manage network and computer systems.,0
Restaurant owner talks to reviewer in order to receive feedback,0
Recycling center attendant talks to customer in order to accept and sort recycled materials,0
DJ talks to partygoer in order to take song requests,0
Landscaper talks to client in order to design a garden,0
Delivery person talks to recipient in order to obtain a signature for their package.,0
Barber talks to customer in order to cut their hair,0
Animal behaviorist talks to zookeeper in order to observe and analyze animal behavior patterns,0
Lawyer talks to jury consultant in order to review jury selection strategy,0
Speaker talks to audience member in order to answer a question.,0
Post office worker talks to customer in order to weigh their package,0
Student talks to college professor in order to discuss academic advising,0
Art director talks to graphic designer in order to create marketing materials,0
Friend talks to friend in order to console them after a loss.,0
Insurance adjuster talks to customer in order to assess damage,0
Aircraft mechanic talks to pilot in order to assess and repair plane issues,0
Social media influencer talks to their audience in order to build a following,0
Supply chain manager talks to supplier in order to coordinate product delivery and inventory management.,0
Diplomat talks to foreign official in order to discuss policy matters.,0
Self-employed individual talks to accountant in order to discuss taxes.,0
Roommate talks to roommate in order to discuss chores,0
Parent talks to speech therapist in order to develop child's speech skills.,0
Antique dealer talks to customer in order to appraise and negotiate a sale,0
Marketer talks to focus group in order to gather product feedback,0
Freelance writer talks to editor in order to pitch article ideas,0
Employee talks to payroll representative about direct deposit.,0
Event coordinator talks to vendors in order to arrange event services and supplies,0
Emergency response coordinator talks to disaster relief team in order to provide assistance,0
Teacher talks to substitute teacher in order to provide classroom coverage.,0
Teacher talks to student in order to provide feedback on an assignment,0
Creative writer talks to editor in order to develop a book,0
Music festival attendee talks to other attendees in order to plan their schedule,0
Homeowner talks to electrician in order to fix an electrical issue.,0
Counselor talks to support staff in order to coordinate client care,0
College admissions officer talks to high school student in order to provide campus tours and information.,0
Pet owner talks to veterinarian in order to schedule a check-up,0
Customer talks to cashier in order to purchase groceries.,0
Businessperson talks to colleague in order to network,0
Sales trainer talks to salespeople in order to provide training.,0
Shopper talks to sales associate in order to ask for size availability,0
Environmental engineer talks to colleagues in order to research and develop environmental solutions,0
Speaker talks to audience in order to deliver a speech,0
Professional organizer talks to client in order to organize their home or office,0
Organizer talks to participant in order to coordinate a community event,0
Therapist talks to family member in order to provide family therapy,0
Tenant talks to property manager in order to report a noise complaint,0
Customer talks to customer service in order to activate a new credit card.,0
Child talks to grandparents in order to catch up,0
Marketing specialist talks to focus group in order to gather data.,0
Customer talks to service technician in order to repair a broken appliance.,0
Customer talks to online chat representative in order to ask questions about a product,0
Volunteer talks to recipient in order to provide assistance.,0
Recruiting manager talks to new hires in order to onboard them.,0
Coworker talks to coworker in order to discuss a workplace policy.,0
Marine biologist talks to fellow researchers in order to research and monitor marine life and ecosystems,0
Volunteer talks to organization representative in order to coordinate volunteer work,0
CEO talks to potential investor in order to secure funding.,0
Homeowner talks to animal control officer in order to deal with a stray animal.,0
Golf blogger talks to subscribers in order to provide golf tips,0
Secretary talks to boss in order to schedule appointments.,0
Job seeker talks to networking contact in order to learn about job opportunities.,0
Lobbyist talks to politician in order to advocate for certain policies.,0
Account manager talks to customer in order to upsell a service.,0
Consultant talks to client in order to provide professional advice and guidance,0
Economist talks to government official in order to discuss policy decisions,0
Employee talks to human resources in order to discuss workplace harassment.,0
Customer talks to auto dealership finance manager in order to secure auto loan,0
Hedge fund manager talks to investor in order to manage investments,0
Nurse talks to biotech engineer in order to discuss medical device use,0
Librarian talks to patron in order to help them find a book,0
Restaurant manager talks to customer in order to address any issues or complaints,0
Homeowner talks to contractor in order to discuss remodeling plans.,0
Makeup effects artist talks to director in order to create and apply special effects makeup for film and TV,0
Talent agent talks to actor in order to develop a career plan.,0
Athlete talks to sports agent in order to negotiate a contract,0
Student talks to classmate in order to study for an exam.,0
Personal trainer talks to gym staff in order to reserve exercise equipment,0
Passenger talks to flight attendant in order to ask for an extra pillow.,0
Couple talks to wedding planner in order to plan their wedding.,0
Film director talks to crew in order to discuss the vision for a movie.,0
Project manager talks to stakeholders in order to provide updates,0
Employee talks to a wellness coordinator about employee wellness programs.,0
Professor talks to research assistant in order to assign research tasks,0
Speaker talks to interpreter in order to understand what the audience is saying.,0
Hiker talks to park ranger in order to obtain trail maps,0
Employee talks to manager in order to request a promotion.,0
Customer talks to grocery store clerk in order to ask for food recommendations,0
Speechwriter talks to politician in order to research and prepare speeches for public addresses,0
Receptionist talks to co-workers in order to relay office updates and information.,0
Co-worker talks to co-worker in order to coordinate schedules.,0
Crime victim talks to police in order to report a crime.,0
Volunteer talks to fellow volunteer in order to schedule shifts,0
Customer talks to customer service representative about a product return.,0
Music teacher talks to student in order to teach music theory and technique,0
Employee talks to coworker in order to plan a company retreat.,0
Job candidate talks to headhunter in order to discuss potential job opportunities,0
Account manager talks to client in order to discuss contract details,0
Parent talks to nutritionist in order to receive guidance on healthy eating for their family,0
Art teacher talks to student in order to guide them in creating art projects,0
Homeowner talks to painter in order to paint rooms inside house.,0
Parent talks to teacher in order to set up a meeting to discuss their child's progress.,0
Teacher talks to custodian in order to clean classroom after school hours.,0
Parent talks to school counselor in order to discuss a child's social development,0
Shopper talks to marketing team in order to get insights on product features.,0
Collector talks to debtor in order to collect a debt.,0
Baker talks to customer in order to design a custom cake,0
Passenger talks to airport security in order to pass through a checkpoint,0
Traveler talks to immigration officer in order to enter a country,0
Digital artist talks to client in order to create a digital art piece,0
CEO talks to top executives in order to plan company's goals for the year,0
Employee talks to IT specialist in order to troubleshoot a computer issue.,0
Shopper talks to store manager in order to request a refund.,0
Electrician talks to colleague in order to coordinate an installation,0
Youth talks to mentor in order to receive guidance and support,0
HVAC worker talks to homeowner in order to assess and fix heating or cooling issues.,0
Medical coder talks to insurance representative in order to process medical claims,0
Actor talks to producer in order to audition for a role,0
Receptionist talks to building maintenance in order to request repairs,0
Employee talks to boss in order to request additional vacation days.,0
Gas station attendant talks to customer in order to process a payment,0
Sales manager talks to sales team members in order to set sales targets.,0
Occupational therapist talks to client in order to provide therapy for daily living skills and job performance,0
Doctor talks to radiologist in order to interpret medical images.,0
House cleaner talks to client in order to understand their cleaning needs,0
Dispensary worker talks to customer in order to recommend a strain of marijuana,0
