domain,exclude
Transportation worker talks to passenger in order to check their ticket or pass.,1
Tourist talks to local business owner in order to learn about cultural events.,1
Club promoter talks to attendee in order to sell tickets to an event.,1
Tourist talks to local in order to receive recommendations for restaurants.,1
Passenger talks to train conductor in order to receive assistance boarding or finding their seat,1
Tourist talks to concierge in order to book activities or tours,1
Customer talks to hotel front desk in order to book room,1
Hostess talks to diners in order to seat them at a restaurant,1
Hotel guest talks to concierge in order to book a restaurant reservation.,1
Tour operator talks to travel agent in order to market tours effectively.,1
Travel agent talks to hotel employee in order to reserve a room,1
Travel blogger talks to tour guide in order to write about a travel experience,1
Tour guide talks to group in order to provide information about a site.,1
Passenger talks to ticket agent in order to book a seat on a train.,1
Travel blogger talks to airport staff in order to provide travel tips and recommendations for tourists.,1
Travel journalist talks to local community members in order to provide travel recommendations and tips.,1
Ticket vendor talks to customer in order to sell admission tickets.,1
Tour guide talks to restaurant to make a reservation,1
Customer talks to travel agent in order to book a vacation.,1
Concierge talks to guest in order to provide recommendations for local attractions.,1
Tourist talks to travel blogger in order to get recommendations for restaurants.,1
Tourist talks to ticket agent in order to purchase admission to an attraction.,1
Passenger talks to taxi driver in order to give directions,1
Travel blogger talks to local in order to recommend hidden gems,1
Driver talks to passenger in order to navigate.,1
Tourist talks to tour guide in order to learn about a city's history.,1
Customer talks to hotel clerk in order to check in,1
Customer talks to restaurant hostess in order to request a table reservation,1
Tour operator talks to hotel staff in order to arrange accommodations.,1
Tour guide talks to business owner in order to schedule a group tour,1
Passenger talks to train conductor in order to ask about arrival times.,1
Tourist talks to transportation services in order to arrange for travel.,1
Travel blogger talks to tourism board representative in order to coordinate travel arrangements,1
Ticket agent talks to passenger in order to issue a boarding pass,1
Homeowner talks to plumber in order to fix a leaky faucet.,0
Patient talks to pharmacist in order to fill a prescription.,0
Customer talks to representative in order to ask for a refund.,0
Candidate talks to campaign manager in order to plan their campaign.,0
Pediatrician talks to parent in order to provide information about child development,0
Customer talks to sales representative in order to learn about a product.,0
Podiatrist talks to patient in order to diagnose foot conditions.,0
Stage actor talks to fellow actor in order to rehearse their lines,0
Parent talks to pediatric dentist in order to receive dental care for their child,0
Court reporter talks to attorney in order to transcribe a trial.,0
Parent talks to college admissions counselor in order to learn about a prospective school.,0
Traveler talks to customs officer in order to pass through security,0
Social media manager talks to coworker in order to plan a social media campaign,0
Politician talks to media in order to give a press conference.,0
Boxer talks to coach in order to strategize for a fight.,0
Contractor talks to client to provide an estimate for a job,0
Expert talks to novice in order to teach a new skill.,0
Parent talks to school principal in order to volunteer as a classroom assistant,0
Homeowner talks to repairman in order to fix a broken household item.,0
Business owner talks to accountant in order to manage finances.,0
User talks to support agent in order to solve a software issue,0
Host talks to DJ in order to create a playlist for a party.,0
Patient talks to surgeon in order to schedule a procedure,0
Motivational speaker talks to audience in order to inspire them,0
Employee talks to payroll manager in order to resolve payroll issues,0
Feng shui expert talks to client in order to create a harmonious living space,0
Shopper talks to personal banker in order to open a checking account.,0
Utility company representative talks to customer in order to verify account information.,0
Public speaking coach talks to client in order to help them prepare for a speaking engagement,0
Driver talks to parking enforcement officer in order to dispute a parking ticket.,0
Personal assistant talks to employer in order to receive task assignments.,0
School counselor talks to student in order to provide emotional support,0
Actor talks to audience member in order to sign autographs,0
Chef talks to waiter in order to finalize menu selections,0
Young adult talks to parents in order to ask for financial support,0
Science fiction author talks to fan in order to discuss favorite books and stories.,0
Magazine editor talks to writer in order to edit their piece.,0
Entertainer talks to audience in order to perform and entertain them,0
Employee talks to manager in order to request a change in work schedule.,0
Coach talks to recruiter in order to find new players for a team.,0
Screenwriter talks to director in order to collaborate on screenplay development and production,0
Employee talks to coworker in order to resolve a conflict,0
Sales manager talks to sales team member in order to track sales progress,0
Customer service representative talks to supplier in order to track an order,0
Scout leader talks to scouts in order to provide instruction on camping and survival skills,0
Scientist talks to lab technician to request tests,0
Accountant talks to client in order to provide financial planning and advice,0
Community organizer talks to members of the community in order to mobilize action,0
Employee talks to HR manager in order to request time off.,0
Driver talks to gas station attendant in order to pay for gasoline.,0
Reiki practitioner talks to client in order to provide energy healing.,0
Busboy talks to waiter in order to communicate the restaurant's needs for clean dishes and table setup,0
Driver talks to DMV worker in order to renew their driver's license.,0
Reader talks to librarian in order to check out a book.,0
Engineering manager talks to engineer in order to discuss project progress,0
Writer talks to editor in order to revise and refine their work,0
Contractor talks to architect to review building plans,0
Chef talks to server in order to provide instructions for a customer's meal,0
Musician talks to audience member in order to promote a show,0
Construction worker talks to supervisor in order to review building plans,0
Voter talks to poll worker in order to cast their ballot.,0
Job seeker talks to career counselor in order to find their ideal job.,0
Employee talks to boss in order to request a shift change,0
Lawyer talks to opposing counsel in order to negotiate a settlement,0
Volunteer talks to organizer in order to sign up for community service.,0
Customer talks to customer service representative in order to address a complaint.,0
Garden center employee talks to customer in order to recommend plants,0
Customer talks to help desk representative about an internet issue.,0
Customer talks to call center representative in order to request a service or product,0
Coworker talks to vendor in order to order office supplies.,0
Book editor talks to author in order to provide suggestions on a manuscript,0
Web developer talks to client in order to create a website,0
Advocate talks to politician in order to push for social change.,0
Interpreter talks to foreign diplomat in order to facilitate communication.,0
Event attendee talks to other attendees in order to network,0
Digital marketer talks to client in order to develop a digital marketing plan,0
Employee talks to a retirement consultant about retirement opportunities.,0
Arbitrator talks to both parties in order to resolve a dispute.,0
Club member talks to club chair to give an idea for fundraiser,0
Nanny talks to child in order to provide childcare services,0
Cosplayer talks to fellow cosplayer in order to show off their costume,0
Worker talks to co-worker in order to share information about a project.,0
Shoe salesman talks to customer in order to assist with shoe selection.,0
Florist talks to customer in order to design a floral arrangement,0
Principal talks to teacher in order to manage curriculum and student progress,0
Politician talks to voter in order to campaign for election.,0
Employee talks to boss in order to ask for an increase in pay.,0
Groundskeeper talks to resident in order to discuss lawn care needs,0
Dog owner talks to dog walker in order to give instructions for the walk.,0
Umpire talks to team captains in order to start a game,0
Job candidate talks to potential employer in order to negotiate salary.,0
Marketing manager talks to internal team in order to plan a trade show exhibit,0
App store developer talks to client in order to create an app for their business,0
Golfer talks to caddy in order to choose clubs,0
Teacher talks to co-teacher in order to coordinate lesson plans.,0
Clothing store employee talks to customer in order to help them find the right size,0
Boss talks to executive to make a decision,0
Firefighter talks to comrade in order to coordinate firefighting efforts,0
Event coordinator talks to sponsor in order to secure funding for an event,0
Choir member talks to conductor in order to rehearse for a performance.,0
CEO talks to shareholders in order to present financial reports,0
Employee talks to co-worker in order to request a favor.,0
Employee talks to union representative in order to address a workplace issue.,0
Client talks to marketer in order to develop advertising campaign.,0
Waiter talks to chef to modify an order,0
Presenter talks to Q&A panelists to ask a question on behalf of the audience,0
Contractor talks to client in order to discuss project details,0
Coach talks to referee in order to contest a call,0
Flight attendant talks to pilot in order to discuss flight procedures.,0
Employee talks to co-worker in order to ask for feedback on a presentation.,0
Architect talks to client in order to design and plan buildings and structures,0
Health enthusiast talks to personal trainer in order to work on fitness goals.,0
Football referee talks to team captains in order to explain game rules,0
Salesperson talks to customer in order to explain product features and benefits and close a sale,0
Retail employee talks to loss prevention in order to report theft,0
Musician talks to bandmate in order to practice and perform together,0
Animal lover talks to breeder in order to select a pet,0
Cosmetologist talks to client in order to apply makeup.,0
Masonry worker talks to supervisor in order to receive instructions for building a structure.,0
Patient talks to dentist in order to get a teeth cleaning.,0
Family member talks to another family member in order to discuss family matters,0
Costume designer talks to director in order to design and create costumes for film and theatre productions,0
Magician talks to audience member in order to perform a trick.,0
Wedding planner talks to vendor in order to coordinate wedding details,0
Artist talks to buyer in order to negotiate the sale of their artwork,0
Editor talks to writer in order to discuss upcoming assignments.,0
Sewing instructor talks to student in order to provide sewing lessons,0
Passenger talks to TSA agent in order to go through airport security,0
Coach talks to opponent coach in order to schedule a game.,0
Auction host talks to attendees in order to bid on items,0
Client talks to public relations manager in order to address press-related issues.,0
CEO talks to public relations specialist about company branding.,0
Job applicant talks to receptionist in order to check in for an interview,0
Wedding blogger talks to bride and groom in order to provide wedding tips,0
Employee talks to colleague in order to brainstorm new ideas for the company.,0
Notary talks to client in order to witness signatures,0
Homeowner talks to insurance agent in order to file a claim,0
Parent talks to tutor in order to set up tutoring sessions for their child.,0
Politician talks to constituents in order to address their concerns,0
Real estate agent talks to appraiser in order to determine a property's value,0
Customer talks to insurance agent in order to sign up for insurance.,0
Speaker talks to event planner in order to coordinate logistics,0
Passenger talks to gate agent in order to check in for a flight,0
Ghostwriter talks to author in order to write a book,0
Gamer talks to fellow gamer in order to coordinate strategy.,0
Employee talks to HR representative in order to update personal information,0
Journalist talks to editor to pitch a story,0
Social activist talks to community members in order to raise awareness and advocate for social justice causes.,0
Coach talks to scout to review an opposing team,0
Stage performer talks to producer in order to discuss a performance schedule.,0
Customer talks to sommelier in order to select a wine,0
Entrepreneur talks to business partner in order to discuss company growth strategies,0
Chef talks to farmer in order to purchase ingredients,0
Passenger talks to flight attendant in order to request a drink,0
Job seeker talks to resume writer in order to improve their resume,0
Personal finance coach talks to client in order to advise on money budgeting.,0
Customer talks to representative in order to cancel a subscription.,0
Nursing home worker talks to elderly resident in order to provide care,0
Salesperson talks to prospective customer in order to follow up on a lead,0
Piano instructor talks to student in order to instruct on piano playing techniques,0
Nutritionist talks to client in order to develop a meal plan that meets their dietary needs,0
Host talks to guest in order to welcome them to a party.,0
Fundraiser talks to donor in order to solicit and receive donations for charitable organizations,0
Firefighter talks to other firefighters in order to put out fires.,0
Parent talks to babysitter in order to leave instructions for their child.,0
Coworker talks to safety representative in order to report a workplace hazard.,0
Participant talks to moderator in order to ask a question during a session.,0
Referee/umpire talks to players and coaches in order to make rulings and enforce rules of a game,0
Parking attendant talks to driver in order to direct them to a parking spot.,0
Virtual assistant talks to employer in order to manage their virtual tasks,0
English language learner talks to tutor in order to improve speaking skills.,0
STEM educator talks to student in order to teach them about coding.,0
Salesperson talks to distributor in order to set up a distribution agreement,0
Attendee talks to speaker in order to say thank you after a presentation.,0
Musician talks to booking agent in order to schedule a gig,0
Celebrity personal assistant talks to celebrity in order to manage their daily tasks,0
Graphic designer talks to client in order to design a custom logo,0
Manager talks to employee in order to provide performance feedback.,0
Real estate developer talks to city officials in order to obtain building permits.,0
Receptionist talks to client in order to provide information about office policies,0
Magician talks to assistant in order to coordinate illusions.,0
Actor talks to scriptwriter in order to ask for clarification on a scene.,0
Judge talks to bailiff in order to instruct court procedures.,0
Dentist talks to insurance adjuster in order to find out what procedures are covered,0
Team member talks to manager in order to provide progress updates.,0
Teacher talks to student in order to give them instructions for the lesson,0
Chiropractor talks to patient in order to diagnose and treat muscle and bone issues,0
Employer talks to employee in order to negotiate benefits,0
Insurance adjuster talks to claimant in order to determine the proper coverage for a claim.,0
Student talks to teacher in order to ask a question about homework.,0
Gardener talks to landscaper in order to swap gardening tips,0
Wedding photographer talks to wedding planner in order to coordinate photo opportunities for an event.,0
Translator talks to client in order to translate a document into a different language,0
Museum director talks to tour guide in order to plan a gallery tour,0
Customer talks to telephone operator in order to make a long-distance call,0
Store clerk talks to shopper in order to assist with finding products,0
Plumbing technician talks to client in order to understand plumbing issues,0
Archaeologist talks to colleagues in order to research and uncover historical artifacts,0
Waiter talks to customer to sing happy birthday,0
Truck driver talks to dispatcher in order to receive delivery instructions,0
Friend talks to friend in order to arrange a social gathering,0
Barista talks to customer in order to take their coffee order,0
Scout talks to athlete in order to evaluate their skills,0
Film director talks to editor in order to finalize a movie.,0
Textbook author talks to editor in order to prepare a manuscript for publication.,0
Inventor talks to patent attorney in order to file a patent for their invention,0
Auctioneer talks to bidders in order to sell an item,0
Esthetician talks to manager to report a customer complaint,0
Pet store employee talks to customer in order to provide pet care advice and sell pet products,0
Children's author talks to illustrator in order to collaborate on book projects,0
Job coordinator talks to employee in order to assign work tasks,0
Hair stylist talks to makeup artist in order to coordinate styling.,0
Beauty consultant talks to customer in order to provide makeup or skincare advice,0
Photographer talks to subject in order to capture their image,0
Human resources representative talks to new employee in order to conduct onboarding.,0
Customer talks to tailor in order to alter clothing,0
Tour guide talks to coworker in order to coordinate group activities.,0
Patient talks to audiologist in order to receive hearing treatment.,0
Architect talks to builder in order to plan construction of a building,0
Parent talks to neighbor in order to arrange a playdate for their children.,0
House guest talks to host in order to ask for additional bedding.,0
Caregiver talks to disabled person in order to assist with daily tasks,0
Employee talks to company representative in order to negotiate a severance package,0
Employee talks to coworker in order to ask for a referral for a job opportunity.,0
Executive talks to shareholder in order to explain financial performance.,0
Fiction writer talks to publisher in order to discuss publishing their book,0
Customer talks to customer service representative in order to report lost or stolen card,0
Linguist talks to foreign language learner in order to teach language skills,0
Environmentalist talks to community in order to promote conservation.,0
Job seeker talks to recruiter in order to discuss job opportunities.,0
Interpreter talks to client in order to help them communicate with someone who speaks a different language,0
Property manager talks to tenant in order to schedule maintenance.,0
Teacher talks to librarian about book selection for a class.,0
Personal shopper talks to client in order to find them the perfect outfit,0
Employee talks to marketing specialist in order to approve advertising campaign,0
Neighbor talks to neighbor in order to form a block watch program,0
Mentor talks to mentee in order to provide guidance,0
Car rental agent talks to customer in order to rent a car.,0
Health insurance specialist talks to healthcare provider in order to resolve billing or coverage issues.,0
Parent talks to therapist in order to seek treatment for their child's emotional issues.,0
Patient talks to genetic counselor in order to understand hereditary risks.,0
Passenger talks to bus driver in order to request a stop.,0
Cashier talks to security to report a theft,0
Sound engineer talks to producer in order to record and produce music and sound projects,0
Shop owner talks to suppliers about product inventory.,0
Plant biologist talks to colleagues in order to research and analyze plant life and growth,0
Orchestra conductor talks to musicians in order to direct and lead musical performances,0
Employee talks to payroll specialist in order to check pay stubs.,0
High school student talks to guidance counselor in order to discuss college options,0
Employee talks to payroll manager in order to enroll in a 401k plan.,0
Private investigator talks to client in order to conduct an investigation,0
Child talks to parent in order to ask for permission,0
Customer talks to sales representative in order to purchase a car.,0
Cashier talks to manager in order to request a price check,0
Cashier talks to supervisor to seek approval for a discount,0
Landlord talks to tenant in order to address a maintenance issue,0
Executive talks to board member in order to discuss company strategy,0
Dentist talks to hygienist in order to coordinate dental procedures,0
Restaurant owner talks to chef in order to plan seasonal menus.,0
Passerby talks to police officer in order to report a crime.,0
Human resources talks to employee in order to schedule work hours.,0
Restaurant manager talks to server in order to assign tables,0
Coworker talks to HR representative in order to request a leave of absence.,0
Postman talks to homeowner in order to deliver mail.,0
Acting coach talks to actor in order to prepare them for a role,0
CEO talks to board of directors in order to present quarterly results,0
Airbnb host talks to guest in order to welcome them and provide information about the property,0
Employer talks to prospective employee in order to conduct a job interview.,0
Golf instructor talks to student in order to teach them how to play golf,0
Retail worker talks to a customer about product knowledge.,0
Host talks to vendor in order to arrange services.,0
Esthetician talks to client to provide a skincare treatment,0
Friend talks to friend in order to catch up on life events.,0
Employee talks to a hiring manager about job opportunities.,0
Fisherman talks to colleague in order to coordinate fishing equipment and operations,0
Parent talks to pediatrician in order to schedule vaccinations.,0
Event coordinator talks to performer in order to make staging arrangements.,0
Interior designer talks to client in order to design a space that meets their needs,0
Homeowner talks to landscaper in order to plant new flowers.,0
Employee talks to recruiter in order to find freelance or gig work,0
Horticulturist talks to clients in order to provide plant and garden landscape advice,0
Substance abuse counselor talks to patients in order to provide addiction counseling and support,0
Blogger talks to editor in order to submit an article for publication,0
Student talks to professor in order to ask for an extension on an assignment.,0
Traffic director talks to drivers in order to manage traffic flow and congestion,0
Salesperson talks to manager in order to discuss sales goals,0
Legal assistant talks to client in order to assist with legal paperwork,0
Restaurateur talks to restaurant staff in order to manage restaurant operations,0
Referee talks to linesman to confirm a call,0
Childbirth instructor talks to pregnant woman in order to provide childbirth education.,0
Police officer talks to dispatcher to request backup.,0
Home health aide talks to patient in order to provide assistance with daily living activities,0
Librarian talks to colleague to recommend a book,0
Participant talks to facilitator in order to contribute to a meeting.,0
Surveyor talks to landowner in order to assess land value.,0
Choir member talks to fellow member in order to harmonize together.,0
Salesperson talks to manufacturer in order to place an order for goods to sell in their store,0
Parent talks to nurse in order to inquire about child's medical health.,0
Construction worker talks to project manager in order to understand their job duties and tasks,0
Environmentalist talks to city council member in order to advocate for green initiatives,0
Human resources manager talks to new hire in order to conduct orientation.,0
Volunteer talks to event sponsor in order to thank them for their support,0
Camp counselor talks to camper in order to plan activities,0
Mail carrier talks to resident in order to deliver mail.,0
Customer talks to airline representative in order to book a flight.,0
Taxidermist talks to customer in order to discuss the details of their taxidermy request,0
Mover talks to customer in order to move their belongings,0
Performer talks to stage crew in order to coordinate a show,0
Restaurant manager talks to kitchen staff in order to coordinate orders and manage inventory,0
Parent talks to athletic coach in order to learn about a team's schedule.,0
"Customer talks to ""geek squad"" specialist in order to troubleshoot a computer issue",0
Service person talks to customer in order to negotiate a mutually beneficial deal,0
Employee talks to a counselor about workplace stress management.,0
Event planner talks to entertainment provider in order to book a performer,0
Parent talks to child in order to provide guidance,0
Salesperson talks to customer in order to make a sale.,0
Professor talks to department chair in order to discuss research funding.,0
